Vulnerability,Severity,Summary
MS11-030: Vulnerability in DNS Resolution Could Allow Remote Code Execution,Critical,"The target is affected by a remote code execution vulnerability in Windows DNS resolution."
Unsupported Windows OS (remote),Critical,"The target is running an unsupported version of Windows, which no longer receives security updates and is therefore exposed to unpatched vulnerabilities."
MS17-010: Security Update for Microsoft Windows SMB Server (4013389),High,"The target is missing Microsoft update KB4013389 and appears vulnerable to MS17-010 on SMBv1. This vulnerability may allow remote code execution through crafted SMB requests and is associated with EternalBlue and WannaCry."
MS16-047: Security Update for SAM and LSAD Remote Protocols (Badlock),Medium,"The target appears vulnerable to the Microsoft advisory related to SAM and LSAD remote protocols."
SMB Signing not required,Medium,"SMB signing is not required on the target, which may increase exposure to certain relay or man-in-the-middle style attacks."
SMBv1 Enabled,Info,"The target still supports SMBv1, an outdated protocol strongly associated with legacy security risks including MS17-010."